### ISSUE TITLE
first command of excute_multiple_output does not run?

### ISSUE THREAD

**Issue by skydig** [magiclen/execute#1]
let mut command1 = execute::command_args!("ping", "-n", "10", "192.168.3.144");
   let mut command = execute::command_args!("ping", "-n", "2", "192.168.3.144");
   command.stdout(Stdio::piped());
   let output = command1.execute_multiple_output(&mut [&mut command]);

I found command1 has not run. why?

test under windows 10

thanks

**Comment by magiclen** [comment]
What is you purpose?

**Comment by skydig** [comment]
just test execute multiple export function，I found the first command is always not invoked

**Comment by magiclen** [comment]
Umm...How could you tell the first command is not invoked? Did you capture the ICMP packets with some tools?

**Comment by magiclen** [comment]
```rust
use std::process::Stdio;

use execute::Execute;

fn main() {
    let mut command1 = execute::command_args!("ping", "-c", "10", "127.0.0.1");
    let mut command = execute::command_args!("ping", "-c", "2", "127.0.0.1");
    command.stdout(Stdio::piped());

    let output = command1.execute_multiple_output(&mut [&mut command]).unwrap();

    println!("{}", String::from_utf8(output.stdout).unwrap());
}
```

Here is my code. On Linux, it works as expected.

The console shows,

```
PING 127.0.0.1 (127.0.0.1) 56(84) bytes of data.
64 bytes from 127.0.0.1: icmp_seq=1 ttl=64 time=0.038 ms
64 bytes from 127.0.0.1: icmp_seq=2 ttl=64 time=0.034 ms

--- 127.0.0.1 ping statistics ---
2 packets transmitted, 2 received, 0% packet loss, time 1015ms
rtt min/avg/max/mdev = 0.034/0.036/0.038/0.002 ms
```

**Comment by magiclen** [comment]
To make sure whether the first command is executed, here is my code (on Linux),

```rust
use std::process::Stdio;

use execute::Execute;

fn main() {
    let mut command1 = execute::command_args!("ping", "-c", "10", "127.0.0.1");
    let mut command = execute::command_args!("cat");
    command.stdout(Stdio::piped());

    let output = command1.execute_multiple_output(&mut [&mut command]).unwrap();

    println!("{}", String::from_utf8(output.stdout).unwrap());
}
```

The console shows,

```
PING 127.0.0.1 (127.0.0.1) 56(84) bytes of data.
64 bytes from 127.0.0.1: icmp_seq=1 ttl=64 time=0.039 ms
64 bytes from 127.0.0.1: icmp_seq=2 ttl=64 time=0.035 ms
64 bytes from 127.0.0.1: icmp_seq=3 ttl=64 time=0.035 ms
64 bytes from 127.0.0.1: icmp_seq=4 ttl=64 time=0.033 ms
64 bytes from 127.0.0.1: icmp_seq=5 ttl=64 time=0.028 ms
64 bytes from 127.0.0.1: icmp_seq=6 ttl=64 time=0.033 ms
64 bytes from 127.0.0.1: icmp_seq=7 ttl=64 time=0.034 ms
64 bytes from 127.0.0.1: icmp_seq=8 ttl=64 time=0.036 ms
64 bytes from 127.0.0.1: icmp_seq=9 ttl=64 time=0.036 ms
64 bytes from 127.0.0.1: icmp_seq=10 ttl=64 time=0.035 ms

--- 127.0.0.1 ping statistics ---
10 packets transmitted, 10 received, 0% packet loss, time 9203ms
rtt min/avg/max/mdev = 0.028/0.034/0.039/0.002 ms
```

It stills works as expected.

**Comment by skydig** [comment]
> ```rust
> use std::process::Stdio;
> 
> use execute::Execute;
> 
> fn main() {
>     let mut command1 = execute::command_args!("ping", "-c", "10", "127.0.0.1");
>     let mut command = execute::command_args!("ping", "-c", "2", "127.0.0.1");
>     command.stdout(Stdio::piped());
> 
>     let output = command1.execute_multiple_output(&mut [&mut command]).unwrap();
> 
>     println!("{}", String::from_utf8(output.stdout).unwrap());
> }
> ```
> 
> Here is my code. On Linux, it works as expected.
> 
> The console shows,
> 
> ```
> PING 127.0.0.1 (127.0.0.1) 56(84) bytes of data.
> 64 bytes from 127.0.0.1: icmp_seq=1 ttl=64 time=0.038 ms
> 64 bytes from 127.0.0.1: icmp_seq=2 ttl=64 time=0.034 ms
> 
> --- 127.0.0.1 ping statistics ---
> 2 packets transmitted, 2 received, 0% packet loss, time 1015ms
> rtt min/avg/max/mdev = 0.034/0.036/0.038/0.002 ms
> ```

 I only see "2 packets transmitted", but the first command send 10 packets, where is the output of first command,  and execute_multiple_output finished very quickly after second command, so I think first command does not work. 
two command will take 12 seconds.

**Comment by magiclen** [comment]
The stdout of the first command is piped to the stdin of the second command. You should use other tools to watch the ICMP packets that you send.

The second command is not executed after the first one. They are working parallelly.

The commands in my first example are equal to `ping -c 10 127.0.0.1 | ping -c 2 127.0.0.1`. The commands in my second example are equal to `ping -c 10 127.0.0.1 | cat`. You can see it does not output the whole logs after it runs 10 seconds, instead it outputs logs line-by-line every 1 second.

**Comment by magiclen** [comment]
I use `tcpdump` to watch the ICMP packets.

```
$ sudo tcpdump -nni lo icmp
tcpdump: verbose output suppressed, use -v[v]... for full protocol decode
listening on lo, link-type EN10MB (Ethernet), snapshot length 262144 bytes
10:37:33.136486 IP 127.0.0.1 > 127.0.0.1: ICMP echo request, id 7, seq 1, length 64
10:37:33.136493 IP 127.0.0.1 > 127.0.0.1: ICMP echo reply, id 7, seq 1, length 64
10:37:33.136509 IP 127.0.0.1 > 127.0.0.1: ICMP echo request, id 8, seq 1, length 64
10:37:33.136513 IP 127.0.0.1 > 127.0.0.1: ICMP echo reply, id 8, seq 1, length 64
10:37:34.150608 IP 127.0.0.1 > 127.0.0.1: ICMP echo request, id 8, seq 2, length 64
10:37:34.150610 IP 127.0.0.1 > 127.0.0.1: ICMP echo request, id 7, seq 2, length 64
10:37:34.150635 IP 127.0.0.1 > 127.0.0.1: ICMP echo reply, id 8, seq 2, length 64
10:37:34.150636 IP 127.0.0.1 > 127.0.0.1: ICMP echo reply, id 7, seq 2, length 64
10:37:35.174640 IP 127.0.0.1 > 127.0.0.1: ICMP echo request, id 7, seq 3, length 64
10:37:35.174666 IP 127.0.0.1 > 127.0.0.1: ICMP echo reply, id 7, seq 3, length 64
```

`ping -c 10 127.0.0.1 | ping -c 2 127.0.0.1` sends 5 packets instead of 2 packets. Hence the first command is definitely executed.

**Comment by skydig** [comment]
> I use `tcpdump` to watch the ICMP packets.
> 
> ```
> $ sudo tcpdump -nni lo icmp
> tcpdump: verbose output suppressed, use -v[v]... for full protocol decode
> listening on lo, link-type EN10MB (Ethernet), snapshot length 262144 bytes
> 10:37:33.136486 IP 127.0.0.1 > 127.0.0.1: ICMP echo request, id 7, seq 1, length 64
> 10:37:33.136493 IP 127.0.0.1 > 127.0.0.1: ICMP echo reply, id 7, seq 1, length 64
> 10:37:33.136509 IP 127.0.0.1 > 127.0.0.1: ICMP echo request, id 8, seq 1, length 64
> 10:37:33.136513 IP 127.0.0.1 > 127.0.0.1: ICMP echo reply, id 8, seq 1, length 64
> 10:37:34.150608 IP 127.0.0.1 > 127.0.0.1: ICMP echo request, id 8, seq 2, length 64
> 10:37:34.150610 IP 127.0.0.1 > 127.0.0.1: ICMP echo request, id 7, seq 2, length 64
> 10:37:34.150635 IP 127.0.0.1 > 127.0.0.1: ICMP echo reply, id 8, seq 2, length 64
> 10:37:34.150636 IP 127.0.0.1 > 127.0.0.1: ICMP echo reply, id 7, seq 2, length 64
> 10:37:35.174640 IP 127.0.0.1 > 127.0.0.1: ICMP echo request, id 7, seq 3, length 64
> 10:37:35.174666 IP 127.0.0.1 > 127.0.0.1: ICMP echo reply, id 7, seq 3, length 64
> ```
> 
> `ping -c 10 127.0.0.1 | ping -c 2 127.0.0.1` sends 5 packets instead of 2 packets. Hence the first command is definitely executed.

thanks, the first command is executed, but is it possible to finished whole first command( ping 10 times, but not 5?)

**Comment by magiclen** [comment]
Again, what is your purpose? If you want to run a command after a command is executed, you should not use the `execute_multiple*` function. Instead, refer to the code below,

```rust
use execute::{shell, Execute};

fn main() {
    let mut command = shell("ping -c 10 127.0.0.1 && ping -c 2 127.0.0.1");

    command.execute_output().unwrap();
}
```

```rust
use execute::{command, Execute};

fn main() {
    let mut command1 = command!("ping -c 10 127.0.0.1");
    let mut command2 = command!("ping -c 2 127.0.0.1");

    command1.execute_output().unwrap();
    command2.execute_output().unwrap();
}
```

```rust
use std::process::Stdio;

use execute::{command, Execute};

fn main() {
    let mut command1 = command!("ping -c 10 127.0.0.1");
    let mut command2 = command!("cat");

    command1.stdout(Stdio::piped());

    let command1_output = command1.execute_output().unwrap();

    command2.execute_input_output(&command1_output.stdout).unwrap();
}
```

**Comment by skydig** [comment]
thanks, understood, execute_multiple* running command in parallel. actually I want to run commands in sequence. thanks again.
